Sentiment,Score,Id_Tweet,Negative,Neutral,Positive,Text_Tweet,Date_Tweet,Nb_interaction,retweet_count,reply_count,like_count,quote_count
Negative,0.714,1584985646052974592,0.7140995,0.21352558,0.07237492,"🎧 ""roanne, une enquête ouverte après qu'un père a frappé l'agresseur présumé de sa fille"" ▶️ écoutez le podcast ""bfm story"" sur notre site et les plateformes de streaming audio 🔊 t.co/pwvipgdkhw t.co/shext489jd",2022-10-25 19:10:00+00:00,7,2,3,2,0
Positive,0.788,1584986877190438918,0.040237267,0.17146678,0.78829604,les belles images de l'éclipse partielle de soleil devant la tour eiffel t.co/bqbqwnwdub,2022-10-25 19:14:53+00:00,74,21,2,49,2
Negative,0.862,1584990074789396486,0.8622175,0.08707527,0.050707262,le procureur de roanne dénonce la violence du père d'une victime contre un adolescent suspecté d'agression sexuelle t.co/hp76ioau4e t.co/v9h8hn9gjr,2022-10-25 19:27:36+00:00,410,27,264,73,46
Negative,0.731,1584990564130455591,0.7310992,0.22361654,0.045284152,vidéoagression sexuelle d'une fillette à roanne: le procureur fait le point sur l'enquête ➡t.co/rcti0sisyi t.co/gbipblxr96,2022-10-25 19:29:32+00:00,23,3,13,6,1
Neutral,0.734,1584990679163363328,0.11999215,0.733924,0.14608386,"🎧 selection. les trois podcasts ""true crime"" à écouter en ce moment t.co/tvgjdyoob3 t.co/cendai0e45",2022-10-25 19:30:00+00:00,6,2,0,4,0
Negative,0.933,1584991975425589249,0.9329665,0.049642306,0.017391352,"roanne: placé en détention provisoire, le mineur accusé d'agression sexuelle nie totalement les faits t.co/vz2kr0s0rz t.co/dir9we5umf",2022-10-25 19:35:09+00:00,85,8,47,30,0
Negative,0.845,1584995526952353792,0.8448426,0.10909105,0.04606624,"ukraine: le fondateur de la milice wagner a critiqué la gestion de la guerre face à poutine, selon le washington post t.co/qfvret3ugd",2022-10-25 19:49:16+00:00,60,14,10,35,1
Positive,0.509,1584996514132361230,0.09956103,0.39107355,0.5093653,90 secondesla nasa vient de lancer une grande enquête pour étudier les ovnis t.co/vtuflebowj,2022-10-25 19:53:11+00:00,54,11,8,33,2
Neutral,0.681,1584998229128740891,0.06864524,0.68076164,0.25059316,"🎧 ""poutine a réuni son conseil de guerre"" ▶️ écoutez le podcast ""bfm story"" sur notre site et les plateformes de streaming audio 🔊 t.co/edjn35r6uz t.co/ajvq24dow6",2022-10-25 20:00:00+00:00,16,2,6,6,2
Negative,0.532,1584998229455667200,0.5316643,0.3767268,0.0916089,"🔴 le nouvel épisode du podcast bfmtv ""le service politique"" est disponible 🎙️ ""le pen: un coup, trois victimes"" avec @loicbesson 🔊 t.co/kzditggl5d t.co/q6wnehhpxn",2022-10-25 20:00:00+00:00,5,1,0,4,0
Negative,0.725,1585002666966540288,0.7245227,0.17373852,0.10173873,"""on ne va pas en rando pour se faire tirer dessus"": ces habitants des campagnes qui en ont ""ras-le-bol"" de la chasse t.co/a5vcfnzqvx t.co/mpzz5faqnd",2022-10-25 20:17:38+00:00,1170,202,124,825,19
Positive,0.589,1585003262045917186,0.051954277,0.35883072,0.589215,"🎧 ""inflation, quand se nourrir devient un luxe"" ▶️ écoutez le podcast ""bfm story"" sur notre site et les plateformes de streaming audio 🔊 t.co/v7lwn1ilql t.co/6hdvi2jgyi",2022-10-25 20:20:00+00:00,12,1,3,8,0
Neutral,0.365,1585006107784843264,0.35280806,0.36542132,0.2817706,des ingénieurs russes pilotent des missiles à distance et bombardent l'ukraine sans bouger de leur bureau t.co/oz8dum7vl6,2022-10-25 20:31:18+00:00,385,49,202,100,34
Negative,0.838,1585009367065145344,0.8381434,0.09532741,0.066529095,"💬 ""on subit de plein fouet toutes les augmentations"" ➡ jérémie ferrer, fondateur d’un groupement d’artisans boulangers, s'inquiète pour l'avenir de sa profession t.co/4k2rq6shml",2022-10-25 20:44:15+00:00,31,4,10,16,1
Negative,0.775,1585009725019660345,0.7753026,0.16843186,0.05626556,🔴 roanne: l'avocat du père de la fillette agressée sexuellement s'exprime sur bfmtv t.co/am3pslg0hu,2022-10-25 20:45:41+00:00,30,6,10,10,4
Negative,0.798,1585010621233627136,0.7981997,0.16858566,0.033214565,"roanne: le père de la fillette ""avait le sentiment que la plainte n'était pas prise en compte"", selon son avocat t.co/59yazwfo7h",2022-10-25 20:49:14+00:00,33,3,8,22,0
Negative,0.885,1585011269849022464,0.8853029,0.07403759,0.040659502,"roanne: pour son avocat, le père de la fillette ""a eu tort d'agir ainsi"" mais ""dans ce contexte, on peut perdre son sang-froid"" t.co/ggdvddamtu",2022-10-25 20:51:49+00:00,56,5,13,36,2
Positive,0.58,1585011770032267272,0.14401221,0.27616927,0.5798185,automne anormalement doux: jusqu'à 30°c attendus jeudi et vendredi par endroit t.co/fk4tduqbgq t.co/o7tfckojkw,2022-10-25 20:53:48+00:00,20,1,6,13,0
Negative,0.773,1585012556208406528,0.7731537,0.17681913,0.050027158,"roanne: l'avocat du père de la fillette agressée parle d'une ""réaction instinctive"" t.co/tkfzkfliwe",2022-10-25 20:56:56+00:00,107,8,28,70,1
Positive,0.513,1585013333370937344,0.10332866,0.38345367,0.5132177,"🎧 ""les paroles glaçantes de dahbia b. en 2019"" ▶️ écoutez le podcast ""bfm story"" sur notre site et les plateformes de streaming audio 🔊 t.co/g3yocnndsr t.co/k2cbaapcry",2022-10-25 21:00:01+00:00,12,2,3,7,0
Negative,0.894,1585016042472046592,0.89355147,0.08616316,0.020285372,guerre en ukraine; la marque kfc va définitivement quitter la russie t.co/jms0c9fhz8 t.co/2zluqqt5og,2022-10-25 21:10:47+00:00,109,10,40,56,3
Neutral,0.468,1585016949263704066,0.21208912,0.46806982,0.31984118,washngton assure que la russie a informé les etats-unis de récents exercices nucléaires t.co/tzzzwpo6ho t.co/iu9oam9qhi,2022-10-25 21:14:23+00:00,78,16,12,48,2
Negative,0.709,1585017338667081728,0.7091053,0.17322889,0.1176658,"💬 ""non la justice n'est pas laxiste, ce n'est pas vrai"" ➡ le coup de gueule de me alain jakubowicz contre le ""bashing généralisé de la justice"" t.co/tivtquus2y",2022-10-25 21:15:56+00:00,1241,208,506,447,80
Positive,0.673,1585018845122666498,0.045885496,0.2806796,0.6734349,assurance chômage: le sénat adopte le projet de loi ouvrant la voie à une possible modulation t.co/9bbqaies4s t.co/0pfavr1niy,2022-10-25 21:21:55+00:00,37,9,5,19,4
Negative,0.836,1585021097166393344,0.8358647,0.11724977,0.046885572,roanne: l'avocat du père ayant frappé l'adolescent suspecté d'avoir agressé sa fille défend son client t.co/xwz6fig9mi t.co/fx9acgbz5z,2022-10-25 21:30:52+00:00,1006,58,239,607,102
Negative,0.624,1585021346697846834,0.6235328,0.21750978,0.15895757,"tableaux aspergés: la ministre de la culture, rima abdul malak, appelle les musées à ""redoubler de vigilance"" t.co/o1srprb3z7 t.co/6gabnntvuw",2022-10-25 21:31:51+00:00,24,2,6,14,2
Negative,0.687,1585022158266576896,0.6865549,0.23304288,0.08040217,les contrôles dans les ehpad suite au scandale orpea ont conduit à trois saisines de la justice t.co/puyha8vmwl t.co/ngkzzsc0cf,2022-10-25 21:35:05+00:00,39,10,5,22,2
Negative,0.863,1585024932538458126,0.86336577,0.10303466,0.033599623,reims: 15 ans de prison confirmés en appel contre un collégien pour le meurtre d'un autre élève t.co/tfzswwo0sm t.co/pmzasq25aa,2022-10-25 21:46:06+00:00,32,6,4,22,0
Negative,0.718,1585025421686579202,0.7183866,0.2294358,0.052177645,crimes sexuels: un diocèse de new york placé sous surveillance de la justice t.co/2qmsqh7ama t.co/aswpcqkeqq,2022-10-25 21:48:03+00:00,22,11,1,10,0
Neutral,0.878,1585026025540710400,0.06222449,0.8777182,0.060057305,résultat euromillions: le tirage du mardi 25 octobre 2022 t.co/fpdaverowl t.co/ijyywxi1zr,2022-10-25 21:50:27+00:00,25,4,3,18,0
Negative,0.885,1585029683254542336,0.88500595,0.084480196,0.03051379,un homme condamné à huit mois de prison ferme pour des menaces contre une mosquée lilloise t.co/wt3ywyhcqo t.co/opuefnlnw2,2022-10-25 22:04:59+00:00,49,8,18,23,0
Negative,0.937,1585032789900107777,0.9373643,0.043474447,0.019161265,"ukraine: biden prévient qu'une attaque nucléaire russe serait une ""erreur immensément grave"" t.co/kjsptmik8x t.co/2nmgkllzae",2022-10-25 22:17:20+00:00,129,9,60,57,3
Negative,0.871,1585036986154459149,0.8712944,0.08622923,0.042476393,"à l'assemblée, des députés insoumis et mélenchon accueillent trois opposants russes à poutine t.co/r5haempy5n t.co/ubifx7uqki",2022-10-25 22:34:00+00:00,51,8,11,30,2
Negative,0.681,1585039318820823065,0.6806123,0.22475746,0.09463025,"guerre en ukraine: rishi sunak appelle zelensky et l'assure du ""soutien inébranlable"" du royaume-uni t.co/aeepx0mqkp t.co/do46ubaj4g",2022-10-25 22:43:16+00:00,87,7,18,60,2
Positive,0.423,1585044611747266560,0.28057808,0.29634106,0.42308074,"avec le rebond des émissions de gaz à effet de serre en 2021, l'europe doit rectifier le tir pour atteindre ses objectifs t.co/9vkbgydncj t.co/xzrhpildom",2022-10-25 23:04:18+00:00,42,6,17,18,1
Negative,0.943,1585058678088007686,0.9427171,0.04168453,0.01559843,un tribunal canadien rejette un accord historique d'indemnisation d'enfants autochtones t.co/oykmqmv7ld t.co/yirju8qh9w,2022-10-26 00:00:12+00:00,20,9,0,11,0
Negative,0.943,1585067367402438657,0.9425568,0.04374166,0.01370154,"""la crise climatique nous tue"": selon une étude, la dépendance à l'égard des énergies fossiles compromet la santé t.co/dt3xasxyoq t.co/eewxgbqtlt",2022-10-26 00:34:44+00:00,29,5,7,17,0
Negative,0.932,1585074728565366784,0.9320429,0.048626352,0.019330703,"roanne: placé en détention provisoire, le mineur accusé d'agression sexuelle nie totalement les faits t.co/vz2kr0s0rz t.co/h7nnqrmmbd",2022-10-26 01:03:59+00:00,47,4,21,20,2
Neutral,0.46,1585092738353176579,0.22839737,0.45978102,0.31182167,chasse: les pistes du gouvernement pour réduire les accidents t.co/c3aj4hwgey t.co/hnkyilrvav,2022-10-26 02:15:33+00:00,25,6,6,13,0
Positive,0.593,1585092860407431173,0.13851942,0.26810667,0.59337395,automne anormalement doux: jusqu'à 30°c attendus jeudi et vendredi par endroit t.co/fk4tduqbgq t.co/h0vrnehd4j,2022-10-26 02:16:02+00:00,25,5,11,8,1
Negative,0.962,1585092971514499072,0.9616447,0.026363317,0.011992053,"nouvel échec pour le gouvernement à l'assemblée, qui rejette la trajectoire budgétaire 2023-2027 t.co/60lsxmizdo t.co/4vsfpkjs8a",2022-10-26 02:16:28+00:00,26,5,5,16,0
Neutral,0.455,1585093130122104832,0.23186652,0.45500377,0.31312975,"35 euros par mois pour manger tous les jours chez del arte: la restauration tentée par le modèle ""netflix"" t.co/uzgig487a6 t.co/kanggphgod",2022-10-26 02:17:06+00:00,65,18,4,37,6
Neutral,0.586,1585093229438959617,0.24149643,0.5862704,0.17223316,"tout comprendrepneus hiver ou chaînes obligatoires cet hiver, ce qu'il faut savoir t.co/2g7ilh2cfe t.co/e8slcs53jq",2022-10-26 02:17:30+00:00,16,3,3,9,1
Positive,0.444,1585111085652353024,0.2637065,0.2925249,0.44376856,"joe biden et rishi sunak soulignent le besoin de ""soutenir l'ukraine"" lors de leur premier échange t.co/kekmmny0dk t.co/gslv10yqip",2022-10-26 03:28:27+00:00,47,5,15,26,1
Positive,0.549,1585120883366150145,0.11894925,0.33178875,0.5492619,ce mercredi sera ensoleillé sur une large partie du pays avec des températures élevées pour la saison t.co/4kdtcfspxo,2022-10-26 04:07:23+00:00,21,5,0,16,0
Negative,0.926,1585121394043518977,0.9258471,0.057064064,0.017088765,crypto: pourquoi le premier ministre anglais rishi sunak pourrait menacer les plans de la france t.co/9vwftagv47 t.co/pzqlpxtep6,2022-10-26 04:09:25+00:00,36,5,11,20,0
Negative,0.948,1585121752589516801,0.94761497,0.03502774,0.017357469,"santé, rémunération et faiblesse numérique: les arguments souvent injustes qui freinent l'embauche des seniors t.co/mhlyytoztw t.co/b2bdkvk1t7",2022-10-26 04:10:50+00:00,15,4,1,9,1
Negative,0.899,1585122396381618178,0.89947695,0.081086814,0.019436132,meurtre de lola: une main courante avait été déposée contre la principale suspecte en 2019 pour des violences t.co/m7whf5rkzu,2022-10-26 04:13:24+00:00,113,34,24,55,0
Negative,0.788,1585122575054766081,0.7878829,0.18259105,0.02952591,corrèze: un homme en garde à vue après la disparition d'une jeune femme t.co/0xzy1nte48,2022-10-26 04:14:06+00:00,20,9,2,9,0
Negative,0.893,1585124331356561408,0.8932158,0.07682248,0.029961815,"""il y avait des endroits où la peau partait"" brûlée au 2ème degré à cause d'une épilation, elle témoigne t.co/zod13yggnk",2022-10-26 04:21:05+00:00,37,9,4,23,1
Negative,0.951,1585124527356448769,0.9507139,0.039256644,0.010029636,"guerre en ukraine: l'inquiétude des évacués de kherson, sans nouvelles de leurs proches restés sur place t.co/ix1cxeicdc",2022-10-26 04:21:52+00:00,27,6,6,14,1
Negative,0.935,1585125965725929472,0.9345453,0.04950616,0.015948612,"dans le var, ce lac a perdu 7 mètres d'eau à cause de la sécheresse t.co/shmsoxzdle",2022-10-26 04:27:35+00:00,39,11,7,19,2
Positive,0.518,1585126949164294145,0.10058832,0.38148224,0.5179295,changement d'heure: la sécurité routière rappelle l'importance de se rendre visible la nuit t.co/grh0fxbkp6 t.co/lgguqylph8,2022-10-26 04:31:29+00:00,30,8,4,18,0
Negative,0.509,1585127014910107648,0.5090784,0.3556036,0.13531795,nucléaire: les quinquennats de françois hollande et emmanuel macron visés par les républicains t.co/gti8ggofwr,2022-10-26 04:31:45+00:00,35,10,2,22,1
Neutral,0.53,1585129886343172096,0.11747572,0.5299315,0.35259292,450€ pour trois mois sans absence: la nouvelle prime de la ratp pour les chauffeurs de bus t.co/e7fzuhfebx,2022-10-26 04:43:09+00:00,179,13,62,83,21
Negative,0.733,1585130202589454339,0.7328035,0.22905453,0.03814183,🔴 info bfmtv corrèze: un homme placé en garde à vue après la disparition d'une jeune femme à brive t.co/5of1zqc6jv t.co/iqiaxzsi64,2022-10-26 04:44:25+00:00,98,30,14,53,1
Negative,0.823,1585130644937621504,0.82339066,0.13874733,0.037861954,"plus cher et plus rare à cause de la grippe aviaire, y'aura-t-il du foie gras à noël t.co/zr1djikeiq",2022-10-26 04:46:10+00:00,31,5,6,11,9
Negative,0.586,1585132999397474304,0.58587134,0.29525426,0.11887443,macron et scholz vont tenter de faire repartir le moteur franco-allemand t.co/pbkrnodkyq t.co/wopq3j0iul,2022-10-26 04:55:32+00:00,65,9,36,17,3
Neutral,0.454,1585133725385478145,0.16314533,0.45361963,0.38323504,le gouvernement veut des contrôles automatisés dans les zones à faibles émissions à partir de 2024 t.co/wyuepsyxks,2022-10-26 04:58:25+00:00,41,9,21,10,1
Negative,0.649,1585134197693464576,0.64857036,0.19287868,0.15855087,"vers un délit d'alcoolémie à la chasse  ""il était temps (...) aujourd'hui, rien n'interdit un chasseur de chasser en état d'ébriété"" l'édito de matthieu @croissandeau t.co/n7tat2q25r",2022-10-26 05:00:17+00:00,40,6,8,22,4
Neutral,0.726,1585135321615896576,0.20012406,0.72584945,0.07402649,enquêtes en cours pour les câbles sectionnés près de marseille et en mer du nord t.co/f5urozmiqr t.co/fxgwgty1sj,2022-10-26 05:04:45+00:00,32,9,3,20,0
Neutral,0.419,1585135451362525184,0.30897045,0.41943592,0.27159363,"vincent cassel, zlatan ibrahimovic, marion cotillard... le casting d'""astérix et obélix"" se dévoile dans une bande-annonce t.co/ldflxvdzju",2022-10-26 05:05:16+00:00,47,5,18,20,4
Neutral,0.408,1585135566072516608,0.2980623,0.40847972,0.293458,ehpad: orpea annonce se placer à nouveau sous protection judiciaire pour renégocier sa dette t.co/xsmqdlmxhn t.co/c5ye1rg2wp,2022-10-26 05:05:44+00:00,11,1,7,3,0
Neutral,0.674,1585138994697871365,0.09995866,0.6741631,0.22587827,"la poste, dassault systèmes et bouygues telecom s'allient pour un cloud ""100% français"" t.co/bvvefqz6gn t.co/rph23piymf",2022-10-26 05:19:21+00:00,41,7,4,28,2
Negative,0.675,1585139771206156290,0.6747741,0.26880452,0.056421362,un homme placé en garde à vue après la disparition d'une jeune femme à brive t.co/15dmkcikap] t.co/hhqcqllnbg,2022-10-26 05:22:26+00:00,46,17,2,22,5
Negative,0.848,1585141047100841984,0.84794545,0.096324064,0.055730425,"""vous ne savez pas de quoi je suis capable"" la suspecte du meurtre de lola visée par une main courante en 2019 t.co/henay7tawn t.co/9mqov8mlzr",2022-10-26 05:27:30+00:00,53,14,7,29,3
Negative,0.951,1585142641582379009,0.9510374,0.034198202,0.014764284,"déficit pluviométrique, vague de chaleur: la sécheresse perdure en france, même en automne t.co/6tkaeaqfaf",2022-10-26 05:33:50+00:00,24,5,3,15,1
Negative,0.9,1585143388818522113,0.89957905,0.061097823,0.03932328,"""le père s'est déchaîné sur le jeune garçon. les séquelles sont très importantes"" le procureur de roanne dénonce la violence du père d'une victime contre un adolescent suspecté d'attouchements t.co/hp76ioau4e t.co/vd41jrblmh",2022-10-26 05:36:49+00:00,3872,190,2385,857,440
Positive,0.536,1585144894783455232,0.213313,0.2507468,0.5359402,"💐 comment cette chaleur automnale impacte les fleurs de saison, comme les chrysanthèmes@cedricfaiche t.co/qdanforrud",2022-10-26 05:42:48+00:00,16,6,4,5,1
Negative,0.925,1585145837327360002,0.9248931,0.051307112,0.023799766,"pour joe biden, ""la russie ferait une erreur immensément grave si elle utilisait une arme nucléaire"" t.co/jyetgsbutn",2022-10-26 05:46:32+00:00,111,17,40,53,1
Neutral,0.622,1585146291197296643,0.1423547,0.6223482,0.23529704,adidas annonce la fin de son partenariat avec kanye west t.co/krpalw7q7i t.co/iontq7mzkj,2022-10-26 05:48:21+00:00,65,7,12,42,4
Negative,0.597,1585146948604071938,0.5967321,0.2552408,0.14802715,chaleur automnale: les sports nautiques prisés par les touristes sur la côte d'azur t.co/re0nshmief,2022-10-26 05:50:57+00:00,20,6,1,13,0
Negative,0.545,1585148341964398593,0.5447056,0.3545933,0.10070106,"en israël, une femme s'apprête à accoucher mais ni elle ni son mari ne sont les parents biologiques@mariegentric t.co/ped7vyl8ac",2022-10-26 05:56:30+00:00,161,21,54,63,23
Neutral,0.554,1585149492734599168,0.27871653,0.55392236,0.16736116,la nupes a-t-elle fait le jeu du rn  l'édito de matthieu @croissandeau t.co/2oxjcapdib,2022-10-26 06:01:04+00:00,115,27,30,43,15
Neutral,0.442,1585154773564678144,0.24804544,0.44244906,0.30950546,.@lodesusbielle dans le métavers avec jean-michel jarre t.co/7uarwsvtss,2022-10-26 06:22:03+00:00,14,4,3,7,0
Negative,0.883,1585155079316951041,0.88292116,0.07870901,0.038369916,"""quand on touche votre petite fille de 6 ans, on touche à ce que vous avez de plus cher"" l'avocat du père ayant frappé l'adolescent suspecté d'avoir agressé sa fille défend son client t.co/0kiuwsbrbp] t.co/5k6lxqdd4f",2022-10-26 06:23:16+00:00,2208,165,262,1746,35
Neutral,0.581,1585155398474006530,0.059977,0.58119124,0.35883167,"""plancha"": l'équipe de ""barbecue"" de retour t.co/jqoepmnf5m",2022-10-26 06:24:32+00:00,17,2,3,11,1
Negative,0.838,1585157552215674880,0.83776134,0.11849494,0.043743838,focus premièreune main courante pour violences déposée en 2019 contre la suspecte du meurtre de lola t.co/3qf6bgghnz,2022-10-26 06:33:05+00:00,22,5,4,12,1
Negative,0.832,1585158080748199939,0.83162355,0.13886167,0.029514767,la clusaz: le projet de retenue collinaire suspendu par la justice t.co/cna0dvfyy0 t.co/nyxxyswq6j,2022-10-26 06:35:11+00:00,22,5,3,14,0
Positive,0.389,1585158283442245633,0.29243279,0.31873718,0.38882992,"""j’étais pas prêt"": jul amusé par la dédicace de vincent cassel dans le prochain ""astérix et obélix"" t.co/nq0zvzdn2c t.co/zeikaq67ll",2022-10-26 06:36:00+00:00,52,6,14,31,1
Negative,0.939,1585158526653108224,0.93915176,0.041474905,0.019373305,"""ça sonne dans le vide"": l'angoisse des réfugiés de kherson face au silence de leurs proches t.co/suem7e6749 t.co/cqvv0es0al",2022-10-26 06:36:58+00:00,14,5,2,7,0
Negative,0.92,1585159513707003904,0.9199268,0.055582155,0.024491124,"💬 ""la russie veut terroriser la population ukrainienne et détruire toute résistance"" ➡ dominique de @villepin, ancien premier ministre t.co/laq6hvgfeu",2022-10-26 06:40:53+00:00,39,5,10,22,2
Positive,0.818,1585161324849516546,0.032204177,0.14970069,0.81809515,"dominique de villepin (@villepin): ""l'unité franco-allemande sur les grands dossiers est un élément indispensable pour faire avancer l'europe"" t.co/uswbz6amqz",2022-10-26 06:48:05+00:00,35,5,11,17,2
Neutral,0.577,1585161460942094337,0.041976023,0.57656217,0.3814619,apple confirme que ses futurs iphone adopteront le même chargeur que les smartphones android t.co/dds3q0cang t.co/sx8nuzgxia,2022-10-26 06:48:37+00:00,262,46,16,186,14
Neutral,0.461,1585163528687714305,0.39170954,0.4612616,0.14702882,"dominique villepin (@villepin): ""je ne suis pas sûr que le président de la république soit toujours au contact du pays et des réalités"" t.co/ukxnzy3i6y",2022-10-26 06:56:50+00:00,2227,428,221,1515,63
Positive,0.504,1585168449394941954,0.12151983,0.37496933,0.5035109,"moral des ménages: léger rebond en octobre, selon l'insee t.co/zdbdf8anjk t.co/4whkjd4ve2",2022-10-26 07:16:23+00:00,36,5,18,9,4
Negative,0.902,1585170999393271808,0.901735,0.07499058,0.023274405,crypto: pourquoi le premier ministre anglais rishi sunak pourrait menacer les plans de la france t.co/7kh2ullqko t.co/2v5qqwvvia,2022-10-26 07:26:31+00:00,22,5,5,10,2
Negative,0.902,1585173890590015489,0.9017165,0.06568359,0.032599933,"de tiktok à la knesset, hadar muchtar pourrait perturber les élections législatives en israël t.co/g6sdgvkxmk",2022-10-26 07:38:01+00:00,12,2,1,9,0
Neutral,0.496,1585175055603990529,0.0962963,0.49642903,0.40727454,msc croisières inaugure son navire-hôtel au gnl pour le mondial au qatar t.co/l5kbpdshbw t.co/ghoqyu5bc2,2022-10-26 07:42:39+00:00,17,3,4,10,0
Negative,0.708,1585175247849922560,0.70801085,0.20629963,0.08568946,"agnès buzyn: le covid, ""tout le monde s'en foutait"" t.co/yfg26vplx9",2022-10-26 07:43:24+00:00,143,32,48,56,7
Negative,0.954,1585176770747269124,0.95421004,0.034867547,0.010922331,"""bombe sale"": pour dominique de villepin, ""la russie veut terroriser la population ukrainienne"" t.co/4htgcs75ye t.co/fiocbm5gv8",2022-10-26 07:49:27+00:00,53,10,10,32,1
Negative,0.788,1585177695503147009,0.7875889,0.1392065,0.073204584,"au québec, des infirmières demandent l'arrêt de ""l'érotisation"" de leur métier pour halloween t.co/j7a7fip7kx t.co/hnd8rbdyey",2022-10-26 07:53:08+00:00,29,6,9,12,2
Negative,0.861,1585178028291801088,0.86113584,0.11738302,0.021481087,elections françaises: des tentatives de manipulation étrangères détectées sur les réseaux sociaux t.co/snbhivnqkn t.co/unlxh3ciz4,2022-10-26 07:54:27+00:00,46,7,14,20,5
Negative,0.688,1585178041092907011,0.6877271,0.19794263,0.114330344,"""le maccabi haïfa était la marionnette de messi"" la presse s'enflamme après le récital du psg t.co/3vpss68zlp t.co/suweth8pwx",2022-10-26 07:54:30+00:00,29,3,2,24,0
Negative,0.921,1585178663422672896,0.9208608,0.062465172,0.016674114,"""nous sommes saturés"": le pr bruno megarbane alerte sur ""des difficultés aggravées"" à l'hôpital t.co/wogunkp1f9",2022-10-26 07:56:59+00:00,90,15,43,29,3
Neutral,0.424,1585179431995326465,0.16907275,0.4239465,0.4069808,"🔴 le nouveau ""le titre à la une"" avec @celinekallmann et @manu_lechypre est en ligne 🎧 ""taxis contre vtc: qui a vraiment gagné la guerre"" 🔊 t.co/vnlq0rtbzu t.co/qwzipvc9wq",2022-10-26 08:00:02+00:00,5,1,0,3,1
Neutral,0.766,1585180068267032580,0.07089221,0.76612586,0.16298194,macos ventura est disponible sur macbook et imac: qu'allez-vous y trouver et comment l'installer t.co/kctkjwnw2a t.co/luebhw0u97,2022-10-26 08:02:34+00:00,6,1,1,2,2
Neutral,0.645,1585180258218688512,0.14402653,0.64491075,0.21106267,"la poste, dassault systèmes et bouygues telecom s'allient pour un cloud ""100% français"" t.co/rlalwkgphf t.co/k6km0kwr4f",2022-10-26 08:03:19+00:00,39,11,4,23,1
Neutral,0.503,1585182272176668673,0.13057004,0.50266594,0.36676383,spotify gagne des abonnés mais reste dans le rouge t.co/ju0hgdjs38 t.co/clpg22w9za,2022-10-26 08:11:19+00:00,10,1,1,8,0
Neutral,0.546,1585184062121058307,0.07122631,0.5462309,0.38254282,"ratp: jusqu'à 450€ de prime ""assiduité"" pour les chauffeurs de bus t.co/mol6wsyvgr",2022-10-26 08:18:26+00:00,32,4,14,12,2
Negative,0.638,1585184615790219265,0.6378478,0.26423252,0.097919665,"""il y avait des endroits où la peau partait"": brûlée au 2e degré lors d'une épilation, elle témoigne sur bfmtv t.co/nxz7iwpgh4 t.co/hu0adaiai6",2022-10-26 08:20:38+00:00,17,2,7,6,2
Neutral,0.367,1585186537326710784,0.35236558,0.36655152,0.28108287,"💬 ""si on voulait changer les choses de manière plus profonde, il faudrait changer le statut comme cela a été fait à la sncf"" ➡ agnès verdier-molinié à propos de la ratp t.co/2ogchikkon",2022-10-26 08:28:16+00:00,135,12,48,57,18
Neutral,0.565,1585187773782401024,0.16397071,0.5648382,0.27119106,"pour la première fois de son histoire, l'afp met aux enchères trois nft t.co/6lmmyfokif t.co/c7n22wfjyo",2022-10-26 08:33:11+00:00,15,2,4,9,0
Neutral,0.681,1585187936605200384,0.12139529,0.6814382,0.19716652,carburants: le décret actant la prolongation de la ristourne jusqu'au 15 novembre est paru t.co/mjiidf1b2b t.co/p0hen0f73t,2022-10-26 08:33:50+00:00,16,4,5,7,0
Negative,0.879,1585188415909380096,0.8793287,0.09420848,0.026462782,nord: un enfant de 7 ans meurt étouffé en mangeant un babybel entier t.co/0jpejptfpp t.co/t4ztzkpjjj,2022-10-26 08:35:44+00:00,892,160,145,537,50
Negative,0.784,1585188807346905088,0.7844006,0.1825862,0.033013348,corrèze: un homme placé en garde-à-vue après la disparition d'une jeune femme à brive t.co/i64rxv6kps,2022-10-26 08:37:17+00:00,29,12,3,13,1
Negative,0.925,1585188886300483585,0.92492867,0.050831743,0.024239635,"💬 ""si on a un enfant malade  si on se fait agresser "" le secrétaire général de la cgt ratp-bus évoque son opposition à une prime ""de présence"" pour les chauffeurs t.co/pgcgubxot3",2022-10-26 08:37:36+00:00,38,2,14,21,1
Positive,0.397,1585191502233280512,0.26814228,0.33481368,0.39704406,le cnc dévoile un clip pour inciter les français à retourner au cinéma t.co/hr9xe7u0qx t.co/2ihuuhjzpt,2022-10-26 08:48:00+00:00,103,6,81,11,5
