Sentiment,Score,Id_Tweet,Negative,Neutral,Positive,Text_Tweet,Date_Tweet,Nb_interaction,retweet_count,reply_count,like_count,quote_count
Positive,0.797,1583447548433666048,0.042041786,0.16060081,0.7973574,"emmanuel macron: ""nous avons consolidé la décision, actée à la sortie de l'été, de réformer le marché de l'électricité européen"" t.co/g6oegfutov",2022-10-21 13:18:09+00:00,149,39,17,83,10
Positive,0.544,1583448070527729666,0.066651024,0.38970444,0.54364455,"🔴 en direct l'union européenne envisage une aide de 1,5 milliard d'euros par mois pour l'ukraine t.co/i2yiu5me6j t.co/fu6us1lk3u",2022-10-21 13:20:13+00:00,6077,808,2450,1687,1132
Neutral,0.853,1583449615583657986,0.036252614,0.8529361,0.11081126,livret a: nouvelle collecte record en septembre t.co/igthj3jakx t.co/v6n8egvcqu,2022-10-21 13:26:22+00:00,20,2,9,7,2
Positive,0.713,1583450179570921472,0.07148225,0.21539637,0.71312124,"emmanuel macron sur le bilan du conseil européen: ""je sors très confiant"" t.co/jf2hdgrgy3",2022-10-21 13:28:36+00:00,79,21,17,39,2
Neutral,0.433,1583450488011366400,0.13606407,0.43342787,0.43050814,"l'ue envisage une aide de 1,5 milliard d'euros par mois pour l'ukraine t.co/t0x6nmaqr6 t.co/2vqbzqurg8",2022-10-21 13:29:50+00:00,848,101,429,223,95
Negative,0.949,1583451516211691521,0.94916743,0.037531912,0.013300521,"meurtre de lola: ""ce qui nous touche tous, c'est l'atrocité de ce crime"", déclare emmanuel macron t.co/mrxvwygxws",2022-10-21 13:33:55+00:00,470,71,177,196,26
Neutral,0.564,1583455266829262848,0.22659335,0.56397206,0.20943445,🔴 en direct kiev affirme avoir repris 88 localités aux forces russes dans la région de kherson t.co/0wrdyvbtgx t.co/tsk2tzj6fl,2022-10-21 13:48:49+00:00,63,7,13,42,1
Negative,0.879,1583456176943304704,0.8792325,0.082361765,0.03840571,"meurtre de lola: emmanuel macron appelle au ""respect et à l'affection"" pour sa famille t.co/m5nkkru4ca t.co/o6buvuoian",2022-10-21 13:52:26+00:00,89,9,34,45,1
Negative,0.909,1583458583617806336,0.9087489,0.07756619,0.013684866,🔴 en direct un responsable russe annonce la mort d'un journaliste dans une frappe à kherson t.co/kjnt5mocfr t.co/lv7leuxeio,2022-10-21 14:02:00+00:00,25,5,6,14,0
Positive,0.446,1583458902150361088,0.18249716,0.3713664,0.4461365,une mère rédige avec humour le cv de son fils pour son stage de 3e t.co/fn5afgwils t.co/w5gedq9ulv,2022-10-21 14:03:16+00:00,84,12,11,57,4
Positive,0.581,1583459343193751559,0.06467608,0.35470608,0.5806179,"planification écologique: borne lance 22 chantiers pour une transition ""plus juste"" t.co/g4ynvuookb t.co/y8zi63doya",2022-10-21 14:05:01+00:00,30,6,9,14,1
Neutral,0.652,1583459635964551171,0.16356196,0.65223247,0.18420558,les ventes de maisons neuves s'écroulent t.co/rh1gtblczi t.co/2qzzycdvwm,2022-10-21 14:06:11+00:00,83,12,29,38,4
Neutral,0.406,1583460431363854336,0.28180936,0.4058294,0.31236133,"🔴 en direct le chef du pentagone exhorte au ""maintien"" de la communication avec moscou t.co/c1fxbbzaov t.co/huzu75sk5r",2022-10-21 14:09:20+00:00,60,14,10,35,1
Negative,0.51,1583462494198284290,0.5104175,0.2765722,0.21301027,"la france sort du traité de la charte de l'energie, jugé trop protecteur des énergies fossiles t.co/dydkxhfpjl t.co/h0bc9lwpvy",2022-10-21 14:17:32+00:00,48,8,8,29,3
Positive,0.745,1583462940941774855,0.05039585,0.20420553,0.7453985,vacances de la toussaint: une météo très douce pour les congés d'automne t.co/ka0qwtqq85 t.co/umypjcnorv,2022-10-21 14:19:19+00:00,12,2,1,9,0
Neutral,0.51,1583462985267306496,0.25134268,0.51028013,0.23837724,comment l'union européenne entend faire baisser le prix du gaz t.co/sj26se88nb t.co/crv353iw24,2022-10-21 14:19:29+00:00,29,5,9,13,2
Neutral,0.454,1583464235937722370,0.315873,0.45417097,0.22995606,l'ukraine affirme avoir repris 88 localités aux forces russes dans la région de kherson t.co/itlbtcngmg t.co/rldxatorga,2022-10-21 14:24:27+00:00,48,6,14,25,3
Neutral,0.423,1583464930321260546,0.2921681,0.42317352,0.28465837,grève dans les centrales nucléaires: un accord salarial trouvé avec les syndicats cgt et fo t.co/bsruyxeish t.co/d5timx9afk,2022-10-21 14:27:13+00:00,59,11,6,37,5
Negative,0.904,1583466161647194112,0.90388554,0.06718528,0.028929135,"naël, 10 ans, est atteint d'un gliome du tronc cérébral, un cancer très rare pour sensibiliser sur sa situation, son père a décidé de rallier montpellier à paris en courant ⤵ t.co/yekxpk62ji",2022-10-21 14:32:06+00:00,69,21,3,45,0
Negative,0.665,1583466274436579329,0.6649246,0.2438466,0.09122881,"🔴""le titre à la une"" avec @celinekallmann 🎧 liz truss, mandat éclair dans une angleterre en crise 🔊t.co/v3ewtean9g t.co/yii8fbirgm",2022-10-21 14:32:33+00:00,7,2,1,3,1
Negative,0.84,1583466285668581377,0.84033024,0.13271224,0.026957355,norvège: un homme blanchi après 21 ans de prison pour un double meurtre t.co/cejjkf450y t.co/fqnpqkfkym,2022-10-21 14:32:36+00:00,25,6,6,11,2
Negative,0.635,1583470064279650304,0.63548696,0.20633568,0.15817732,"""pas là pour souffrir"": après un autre 49.3, les députés macronistes assument le service minimum t.co/aiz2zbbgey t.co/8vah1muhhv",2022-10-21 14:47:37+00:00,29,3,11,13,2
Neutral,0.538,1583471362907045888,0.13043389,0.53842604,0.33113998,🔴 alerte info royaume-uni: penny mordaunt annonce sa candidature pour devenir première ministre t.co/mmkzwbbjmd t.co/gwquykwjip,2022-10-21 14:52:47+00:00,120,25,20,69,6
Positive,0.478,1583472895027982336,0.04732379,0.47429693,0.47837934,carburant: les stations-service sur les autoroutes et les routes nationales les plus fréquentées seront desservies en priorité t.co/axwzgrxmkw,2022-10-21 14:58:52+00:00,19,2,7,9,1
Negative,0.834,1583472965420986368,0.83378744,0.15012948,0.016083054,meurtre de lola: une mosquée taguée près de bordeaux t.co/532dow4zak t.co/1j7n1xwal6,2022-10-21 14:59:09+00:00,754,66,224,408,56
Negative,0.917,1583474059693760515,0.9169191,0.06621692,0.016863793,"en faillite, la banque nuri demande à ses clients de retirer leurs cryptomonnaies t.co/zdmomp8vvp t.co/aiylgavwex",2022-10-21 15:03:30+00:00,12,3,1,6,2
Neutral,0.486,1583474498141052930,0.35698292,0.48594314,0.15707383,le déficit budgétaire des etats-unis réduit de moitié en 2022 t.co/qmx2qe6vdg t.co/ksjxk14oat,2022-10-21 15:05:14+00:00,17,1,5,11,0
Negative,0.532,1583475297197907968,0.5323175,0.3933669,0.07431546,l'inflation en grandes surfaces s'approche des 10% t.co/4rijwhzzfj t.co/u24ufpcmik,2022-10-21 15:08:25+00:00,81,24,25,25,7
Negative,0.861,1583476572375302145,0.86050713,0.11355862,0.02593427,"🔴 info bfmtv meurtre de lola: invité par la famille, gérald darmanin se rendra aux funérailles de la jeune fille t.co/xqisi9eppy t.co/edhraflodf",2022-10-21 15:13:29+00:00,2609,233,908,1276,192
Negative,0.75,1583476681007693824,0.74970996,0.10940325,0.14088675,"grèves: ""nous poursuivrons ce bras de fer, cette bagarre, jusqu'à ce que le gouvernement accepte de faire en sorte que l'ensemble des salaires évolue au même niveau que l'inflation"", affirme fabien roussel (@fabien_roussel) t.co/qhopmvrgth",2022-10-21 15:13:54+00:00,173,43,26,102,2
Negative,0.672,1583479375198318592,0.6717502,0.24597594,0.08227388,"🔴 alerte info la famille de lola s'oppose à l'utilisation des ""nom et image de leur enfant à des fins politiques"" t.co/lho8lj6ikc t.co/qyov9qbhja",2022-10-21 15:24:37+00:00,1398,173,214,974,37
Negative,0.825,1583481715229851648,0.8247947,0.12713046,0.04807476,🔴alerte info hassan iquioussen: la justice belge refuse la remise à la france de l'imam marocain t.co/t0tuvguiyl t.co/7dtt6yhu0c,2022-10-21 15:33:55+00:00,2921,430,730,1498,263
Neutral,0.649,1583482032625270785,0.06275979,0.64867437,0.28856596,electricité: un nouveau dispositif pour les entreprises exclues du bouclier tarifaire t.co/tevlln2eab t.co/8f4w9zfzwy,2022-10-21 15:35:10+00:00,14,4,1,9,0
Negative,0.867,1583486821442654208,0.8671096,0.108910136,0.023980265,chasses traditionnelles à l'alouette: les nouvelles autorisations suspendues par la justice t.co/00xbflgnnv t.co/5wpxjkvxj3,2022-10-21 15:54:12+00:00,84,21,11,47,5
Negative,0.873,1583488148507529216,0.87296087,0.096809946,0.030229159,lana del rey demande à ses fans de ne pas écouter ses chansons fuitées après le vol de son ordinateur t.co/tgopyp1tki t.co/269p2y1dyd,2022-10-21 15:59:29+00:00,41,4,11,23,3
Neutral,0.486,1583489359764156422,0.19342424,0.48599243,0.3205833,🔴 info bfmtv reconquête résilie les noms de domaine au nom de lola après la demande de la famille t.co/oyxyer7kbt t.co/quplbqmwz2,2022-10-21 16:04:17+00:00,2930,375,498,1742,315
Neutral,0.491,1583489764870668288,0.20567489,0.4913314,0.30299369,🔴 alerte info italie: giorgia meloni officiellement nommée première ministre t.co/8bezfkuaiv t.co/cvveqbysbj,2022-10-21 16:05:54+00:00,1195,144,100,922,29
Neutral,0.723,1583491031982555136,0.08710874,0.72332656,0.18956475,prédictions: le bitcoin va-t-il bénéficier d'un effet halloween t.co/izn8mefha4 t.co/wpxxrl9jof,2022-10-21 16:10:56+00:00,10,2,2,6,0
Negative,0.6,1583493937616113664,0.60036033,0.31813306,0.08150678,le gendarme de l'énergie enquête sur un deuxième fournisseur alternatif t.co/px9odnx3ml t.co/dqalufkprw,2022-10-21 16:22:29+00:00,16,3,4,9,0
Positive,0.525,1583494061477855235,0.17703103,0.29792055,0.5250485,le village de fouquereuil rend hommage à lola en présence de membres de sa famille t.co/wc3sckemns,2022-10-21 16:22:58+00:00,79,9,39,26,5
Negative,0.84,1583494130227122177,0.8395993,0.11465854,0.045742027,"soutiens insuffisants, enquête parlementaire: le ""come back"" complexe de boris johnson t.co/o7bxidy122 t.co/qujnr6azav",2022-10-21 16:23:15+00:00,22,4,5,12,1
Neutral,0.714,1583495937158451202,0.070506796,0.71366775,0.21582535,"🎧 ""tu veux que je te raconte l'histoire du “manchot équipé de chaussures orthopédiques” "" ▶️ le nouvel épisode du podcast ""les dents et dodo"" est dispo sur notre site et sur toutes les plateformes de streaming audio 🦷 🔊 t.co/3aphn9wfre t.co/umlwk1e5k6",2022-10-21 16:30:26+00:00,11,4,6,1,0
Negative,0.844,1583500834020548625,0.8442204,0.11986266,0.0359169,🔴 alerte info refus de la justice belge de remettre hassan iquioussen à la france: le parquet fait appel t.co/t0tuvgczkd t.co/cqepu0osuy,2022-10-21 16:49:53+00:00,89,9,50,25,5
Negative,0.802,1583501421429010436,0.80240023,0.17778175,0.01981808,duplex interrompu en ukraine: ce qu'il s'est passé pour nos envoyés spéciaux t.co/7kbccajxui,2022-10-21 16:52:13+00:00,303,26,193,64,20
Negative,0.901,1583505300631744512,0.9006695,0.08474773,0.0145826135,meurtre de lola: ses deux frères présents à l'hommage organisé par la commune de fouquereuil t.co/b3wwkddpd5 t.co/0ym0llgiov,2022-10-21 17:07:38+00:00,36,2,17,16,1
Negative,0.571,1583505344839524357,0.5707904,0.29186425,0.13734528,balenciaga rompt ses relations avec kanye west t.co/rw9ir9acct t.co/ntbzzegvff,2022-10-21 17:07:48+00:00,44,4,11,27,2
Negative,0.772,1583511130018025472,0.77158815,0.17274219,0.055669688,seine-saint-denis: un homme armé d'un couteau interpellé à la mosquée de drancy t.co/zjs0eqay00 t.co/orvufszznn,2022-10-21 17:30:48+00:00,46,16,10,20,0
Negative,0.655,1583512557930786816,0.65453255,0.2045162,0.14095128,"""inaction politique"": les soignants somment macron d'agir face à la saturation des urgences pédiatriques t.co/qycwivfnpp t.co/d2ralcyb02",2022-10-21 17:36:28+00:00,32,9,5,18,0
Negative,0.861,1583512996369793026,0.86093915,0.099652246,0.039408755,"exxonmobil accusé de léser sa filiale esso, la justice ordonne une expertise t.co/etgpf7gmau t.co/hncpaebw5a",2022-10-21 17:38:13+00:00,16,1,1,14,0
Neutral,0.489,1583515408165834753,0.04073509,0.48869774,0.47056717,"""je suis prêt pour ça"": la candidature de boris johnson pour le poste de premier ministre se précise t.co/rfr128luzc t.co/rvwmwb3gvp",2022-10-21 17:47:48+00:00,796,76,160,499,61
Positive,0.465,1583517671873576960,0.19420643,0.34103182,0.46476176,états-unis: joe biden prédit un revirement en faveur des démocrates pour les élections de mi-mandat t.co/khe1zcmmoo t.co/aitmioskk5,2022-10-21 17:56:47+00:00,61,6,27,26,2
Negative,0.907,1583520791605350400,0.90712404,0.07966825,0.013207642,meurtre de lola: en quoi consiste l'expertise psychiatrique d'un suspect dans une enquête criminelle t.co/hchlyegtij t.co/pvczeal6ti,2022-10-21 18:09:11+00:00,27,5,12,10,0
Negative,0.894,1583522492576321537,0.89417726,0.085581444,0.020241288,49.3 sur le budget: pourquoi les motions de censure ont très peu de chances d'aboutir t.co/n15izpqxkk,2022-10-21 18:15:57+00:00,36,8,11,16,1
Negative,0.775,1583522809308884992,0.77469575,0.14556602,0.07973821,"gironde: après un refus d'obtempérer, le chauffard reconnaît avoir percuté un gendarme t.co/sjupjdedsz t.co/lf9mhqjuaj",2022-10-21 18:17:12+00:00,69,13,9,45,2
Negative,0.475,1583524175049682944,0.4750424,0.31632802,0.20862956,l'ukraine réclame une mission d'observation internationale au barrage de kakhovka t.co/jtl2eng2qd,2022-10-21 18:22:38+00:00,88,23,13,49,3
Negative,0.73,1583526373439594496,0.73038214,0.19183417,0.07778351,"""si le barrage de kakhovka explose, kherson sera inondée en deux heures"", explique marianne babich t.co/xmhcgmjwy6",2022-10-21 18:31:22+00:00,38,14,7,15,2
Negative,0.934,1583527676945760257,0.9340229,0.05479453,0.011182461,indonésie: 133 enfants morts après l'ingestion de sirops suspects t.co/3r22sdmpgq t.co/bofid8hury,2022-10-21 18:36:33+00:00,45,23,5,16,1
Neutral,0.588,1583527769233055744,0.050332744,0.5876174,0.36204985,paris: près de 400 personnes participent à une veillée pour lola dans le 19e arrondissement t.co/pxec76awzz,2022-10-21 18:36:55+00:00,104,14,18,71,1
Negative,0.566,1583527791211204608,0.56634223,0.30336255,0.1302951,"communication, médecine de ville... le plan d'action de l'ars île-de-france contre l'épidémie de bronchiolite t.co/54k1c5xk6i t.co/hpdyn9z9bp",2022-10-21 18:37:00+00:00,10,3,5,2,0
Neutral,0.554,1583528462379151360,0.16106993,0.55431986,0.28461027,lola: l'hommage dans le village familial de fouquereuil t.co/0cv6dbx2zq,2022-10-21 18:39:40+00:00,50,8,7,33,2
Negative,0.572,1583529119270449153,0.5717791,0.2808816,0.14733924,les avocats de l'imam hassan iquioussen saisissent la justice pour diffamation contre gérald darmanin t.co/avd2gzbnh9 t.co/qyahf6e8jm,2022-10-21 18:42:17+00:00,87,8,28,48,3
Negative,0.921,1583533587026317312,0.9206403,0.05663,0.022729883,"🔴 ""meurtre de lola: la barbarie et l'effroi"": suivez notre long format inédit sur bfmtv t.co/ytdiiioa5x",2022-10-21 19:00:02+00:00,91,12,47,22,10
Positive,0.674,1583539474503696384,0.06397499,0.2625117,0.67351335,"💬 ""c'était une petite très gentille avec du caractère"" ➡ cette mère de famille se souvient de lola, une amie de sa fille t.co/jflieqajpp",2022-10-21 19:23:26+00:00,84,8,22,52,2
Negative,0.825,1583539902415011841,0.82526755,0.1424694,0.032263126,meurtre de lola: emma a déposé un bouquet de fleurs pour sa meilleure amie t.co/f6nqzqwswa,2022-10-21 19:25:08+00:00,71,6,20,42,3
Negative,0.822,1583543527589306368,0.82226104,0.1494337,0.028305352,le rappeur luv resval est mort à l'âge de 24 ans t.co/7hmf0qaznz t.co/0dltoie9pk,2022-10-21 19:39:32+00:00,978,58,92,799,29
Neutral,0.842,1583544928831156224,0.09004786,0.8417977,0.06815431,résultat euromillions: le tirage du vendredi 21 octobre 2022 t.co/pookvj62j4 t.co/ahucyfxmvs,2022-10-21 19:45:06+00:00,16,1,2,13,0
Negative,0.579,1583546368265637888,0.57913244,0.3471586,0.07370887,"la commission d'enquête sur l'assaut du capitole cite trump à comparaître ""autour du 14 novembre"" t.co/kurpznh6xw t.co/ifsq4jqdkj",2022-10-21 19:50:49+00:00,43,8,9,26,0
Negative,0.447,1583549254609817600,0.44697335,0.24678227,0.3062443,"⚽ ""si on découvre la contrepartie une fois qu'on est sur place, c'est gênant"" 👉 invité tous frais payés à la coupe du monde au qatar, joseph a choisi de ne pas y aller il explique pourquoi ⤵ t.co/xslrorblcc",2022-10-21 20:02:17+00:00,70,8,19,41,2
Negative,0.537,1583556877509529602,0.5366742,0.24432364,0.21900217,"mexique: les images impressionnantes d'un train en feu, après sa collision avec un camion citerne qui a explosé⤵ t.co/qluo0qvzcg",2022-10-21 20:32:35+00:00,28,14,1,12,1
Negative,0.928,1583558146458812416,0.92791843,0.059994806,0.012086724,"💿 lana del rey victime d'un vol, plusieurs chansons inédites ont fuité t.co/hwdid9bjls",2022-10-21 20:37:37+00:00,45,4,6,31,4
Negative,0.96,1583558944470884353,0.96026415,0.026944848,0.012791017,"l'ukraine craint ""un désastre de grande ampleur"" au barrage hydroélectrique de kakhovka t.co/pmm7lbh3ns",2022-10-21 20:40:48+00:00,64,16,22,25,1
Neutral,0.506,1583560270479515649,0.33805743,0.50557613,0.15636644,"""fabuleux, unique"": trois baleines aperçues au large de six-fours-les-plages t.co/3h1ztxcfjd t.co/gqw8edexr5",2022-10-21 20:46:04+00:00,110,14,8,86,2
Negative,0.758,1583560486343553024,0.75848395,0.1440824,0.09743362,"catherine colonna: ""renforcer l'isolement de vladimir poutine ne serait pas une bonne option"" t.co/r4nfghrsqh",2022-10-21 20:46:55+00:00,126,18,50,32,26
Negative,0.895,1583561605908172801,0.8953859,0.09097578,0.013638288,pays-bas: deux morts suite à une collision entre un ferry et bateau taxi t.co/xtlowy6gxl t.co/evelwvlpfp,2022-10-21 20:51:22+00:00,16,4,0,12,0
Negative,0.93,1583563495936622592,0.9304262,0.056868106,0.0127057,"femme tuée et dépecée en 2017: un homme condamné à 30 ans de prison, son frère acquitté t.co/hvubncwocv t.co/c3vq6thvap",2022-10-21 20:58:53+00:00,16,3,3,10,0
Neutral,0.515,1583564860855488512,0.31492743,0.51521796,0.16985458,paris: des habitants du quartier où habitait lola se recueillent lors d'une veillée en sa mémoire t.co/kix3sk1ofj,2022-10-21 21:04:18+00:00,41,3,18,20,0
Negative,0.756,1583565770449358848,0.7558164,0.16673881,0.07744483,"pour catherine colonna, renforcer l'isolement de poutine ""ne serait pas une bonne option"" t.co/vaiuhy0chh t.co/icpk0yuwzw",2022-10-21 21:07:55+00:00,35,3,13,19,0
Neutral,0.429,1583570870676529152,0.2726185,0.42897004,0.29841143,🌍 plus de huit millions de tonnes de plastique sont déversées dans les océans chaque année 👉 voici deux solutions pour nettoyer les océans t.co/agdydvg4zn,2022-10-21 21:28:11+00:00,70,17,6,44,3
Negative,0.496,1583577855350689792,0.49648336,0.3517816,0.15173508,🔴 alerte info grande-bretagne: rishi sunak dépasse le seuil des 100 parrainages requis t.co/xztux1pjtv t.co/pprdxwlist,2022-10-21 21:55:56+00:00,54,10,12,30,2
Neutral,0.476,1583578541869834240,0.41738296,0.47616884,0.10644823,"l'enquête- suprémacistes blancs, nationalistes, néonazis, génération identitaire: le profil des personnes présentes à la manifestation pour lola, organisée par une association proche du parti d'éric zemmour (@nelsongetten) t.co/5lqwzlxitj",2022-10-21 21:58:40+00:00,6253,1311,1888,2486,568
Neutral,0.622,1583669816564797441,0.22977579,0.62186134,0.14836285,🔴 info bfmtv-rmc jean-luc lahaye privé par la justice de son retour sur scène t.co/rpvfuldoxo t.co/anhgkfkkfz,2022-10-22 04:01:22+00:00,426,32,115,260,19
Neutral,0.528,1583675449778966528,0.13166296,0.52750593,0.34083122,météo: un temps sec et doux sur la majorité du pays t.co/ni99ac0kr3 t.co/r7lf3pwydp,2022-10-22 04:23:45+00:00,37,6,6,25,0
Neutral,0.368,1583681157064839168,0.30640158,0.36818284,0.32541558,"etats-unis: joe biden dit avoir l'""intention"" d'être candidat à un nouveau mandat en 2024 t.co/7l4xrpx6uy t.co/dy3sxf4pzh",2022-10-22 04:46:25+00:00,1964,151,1070,579,164
Negative,0.447,1583686540110491649,0.44735813,0.3835901,0.16905178,les européens réclament une enquête de l'onu sur les drones iraniens en ukraine t.co/jmv8fmhqf2 t.co/yc7hhtbjqj,2022-10-22 05:07:49+00:00,62,12,22,27,1
Positive,0.859,1583688145769746432,0.017270923,0.123386756,0.8593424,☀🌡 une journée printanière ce samedi t.co/eludpw15kj,2022-10-22 05:14:12+00:00,18,4,0,14,0
Negative,0.856,1583688753494732800,0.85635334,0.10128462,0.042362,"pour le japon, l'usage par la russie du nucléaire serait ""un acte d'hostilité contre l'humanité"" t.co/di0tnqttxz t.co/lodyjlrp8l",2022-10-22 05:16:37+00:00,358,49,84,220,5
Negative,0.863,1583690645750718467,0.8631293,0.11484218,0.022028446,meurtre de lola: les hommages avant les obsèques prévues ce lundi t.co/dgpo0vibjt,2022-10-22 05:24:08+00:00,52,10,13,28,1
Negative,0.878,1583692056488476674,0.878112,0.09590316,0.025984757,pénurie de carburant: du mieux sur la route des vacances t.co/4t7ncuwf1m,2022-10-22 05:29:44+00:00,40,6,10,24,0
Negative,0.937,1583693242888921088,0.93664527,0.049173616,0.014181041,"sécheresse: dans les alpes-maritimes, des restrictions sans fin t.co/43gpmd9bks",2022-10-22 05:34:27+00:00,31,9,5,17,0
Neutral,0.755,1583694413112279041,0.11156583,0.75541663,0.13301753,sport: les éclopés du running t.co/ogo7ltrnma,2022-10-22 05:39:06+00:00,40,5,4,28,3
Negative,0.902,1583698046549835776,0.90217835,0.0625676,0.035254188,"chine: paraissant affaibli, l'ex-président hu jintao escorté vers la sortie lors du congrès du parti communiste chinois t.co/grmgueunyw",2022-10-22 05:53:32+00:00,143,30,31,74,8
Negative,0.907,1583699044131831808,0.9067884,0.073590115,0.01962131,royaume-uni: les ravages de l'inflation t.co/bpqvjhvll8,2022-10-22 05:57:30+00:00,89,29,15,38,7
Neutral,0.662,1583701475091312640,0.14918086,0.66219056,0.18862863,"sortie de ""l'arche de rantanplan"": lucky luke chez les végans t.co/wp9rwscioc",2022-10-22 06:07:10+00:00,22,8,1,12,1
Positive,0.386,1583706410239393792,0.22949505,0.38470748,0.38579738,"a bientôt 80 ans, joe biden dit avoir l'""intention"" d'être candidat à un nouveau mandat en 2024 t.co/7l4xrpx6uy",2022-10-22 06:26:46+00:00,428,24,234,126,44
Positive,0.462,1583706647662252032,0.07698347,0.46067142,0.46234494,🔭 les astronomes amateurs appelés à aider la nasa pour récolter des informations sur l'astéroïde eurybate t.co/hysdxomnhx,2022-10-22 06:27:43+00:00,18,7,2,9,0
Negative,0.528,1583706873739751424,0.52785957,0.3517817,0.12035864,chine: l'ancien président hu jintao escorté vers la sortie lors du congrès du parti communiste t.co/anpd8mauoj t.co/k72cuzlkvt,2022-10-22 06:28:37+00:00,89,14,13,59,3
Neutral,0.508,1583708343109005313,0.3785519,0.50821966,0.11322843,balancetonsalaire: la fin d'un tabou avec ses collègues de travail t.co/1andhjcdky,2022-10-22 06:34:27+00:00,51,8,16,23,4
Neutral,0.703,1583708850313728002,0.025866056,0.7032068,0.27092728,le plan des constructeurs français pour des petites voitures électriques à un prix abordable t.co/jqb6lhmx41 t.co/2wicvldnm9,2022-10-22 06:36:28+00:00,38,8,8,21,1
Negative,0.884,1583709042559488000,0.88368267,0.10312276,0.01319455,costa rica: disparition d'un avion avec cinq allemands à bord t.co/a9hnawobdk t.co/lhoolkwulh,2022-10-22 06:37:14+00:00,14,3,2,9,0
Negative,0.726,1583709240471920640,0.726354,0.18150832,0.09213749,"un homme armé d'un couteau interpellé à la mosquée de drancy, l’imam chalghoumi évacué t.co/zjs0epsols",2022-10-22 06:38:01+00:00,63,9,20,32,2
Negative,0.892,1583711083788783617,0.89234674,0.07611975,0.03153346,"meurtre de lola: reconquête, le parti d'éric zemmour, fait marche arrière et supprime son site internet dédié à la fillette t.co/k11tgdhxgs",2022-10-22 06:45:20+00:00,74,9,37,24,4
Positive,0.567,1583715490630770731,0.09872474,0.33380747,0.56746775,vacances de la toussaint: profiter avec un budget serré t.co/gzcyzidfjv,2022-10-22 07:02:51+00:00,17,3,4,10,0
Negative,0.913,1583719153738739714,0.9127657,0.06398947,0.023244647,l'ouragan roslyn va frapper la côte pacifique du mexique t.co/9bpnllb49o,2022-10-22 07:17:24+00:00,23,5,1,16,1
Negative,0.672,1583719544119783424,0.6722604,0.20364149,0.12409803,"assaut du capitole: biden juge qu'il serait ""logique"" que trump se plie à la citation à comparaître t.co/1b7mbs1jqc t.co/tbwizz1puz",2022-10-22 07:18:58+00:00,59,4,25,30,0
Positive,0.619,1583721165138558977,0.02454073,0.3569286,0.61853063,"""je suis prêt pour ça"": la candidature de boris johnson pour le poste de premier ministre se précise t.co/rfr128urxc",2022-10-22 07:25:24+00:00,101,10,37,47,7
Negative,0.926,1583721712557780992,0.9264006,0.057548027,0.01605122,bouches-du-rhône: deux enfants meurent dans un accident de voiture sur l'a50 t.co/xiechayuob,2022-10-22 07:27:35+00:00,11,2,3,6,0
Negative,0.924,1583723725542785024,0.9239146,0.057529833,0.018555608,"a cause de la ""double peine de pauvreté"", les ménages modestes perdent 1536 euros chaque année t.co/f0zhil19sd t.co/3nct9gcjg5",2022-10-22 07:35:34+00:00,53,11,16,24,2
Neutral,0.599,1583723904673075205,0.09305557,0.59918904,0.3077554,"cette nuit, la nasa en appelle aux astronomes amateurs en france pour observer le passage d'un astéroïde t.co/t3xx4s40vq",2022-10-22 07:36:17+00:00,24,8,1,15,0
Neutral,0.466,1583724797300994049,0.42278582,0.4659619,0.11125226,jean-luc lahaye privé par la justice de son retour sur scène t.co/3nkijw2cbp,2022-10-22 07:39:50+00:00,61,9,23,25,4
Neutral,0.759,1583725619229122561,0.050872408,0.7586063,0.19052126,"tiktok, instagram: cinq comptes fiables qui parlent de santé mentale t.co/dik1mdcqt4 t.co/kbbbzal2gr",2022-10-22 07:43:06+00:00,11,5,1,4,1
Neutral,0.414,1583725755951124480,0.3417451,0.4137461,0.24450879,"chine: xi jinping sort renforcé du congrès du parti communiste, avant un probable 3e mandat inédit t.co/r42kvrhwbv t.co/ga4rgdyp9u",2022-10-22 07:43:39+00:00,58,12,8,32,6
Neutral,0.761,1583725980182786048,0.08791641,0.76129264,0.1507909,"la pochette des wampas, les chansons de cali: les albums du groupe et de l'artiste intervertis t.co/7b2l7cxhwr",2022-10-22 07:44:32+00:00,17,5,2,9,1
Positive,0.692,1583729608318283776,0.08237955,0.22572978,0.6918907,"ballon d'or: le détail des votes, avec l'ultra-domination de benzema... et quelques surprises t.co/xmprkxvvjn",2022-10-22 07:58:57+00:00,22,4,5,13,0
